noticia,fecha,oracion,sustantivos,personas,organizaciones,cant_personas,0,1,2,3,4
662.txt,20120622,"""Today we meet to point out Elian Karel to us,"" Silvia Marek said the enthusiastically, much which delayed the white candles in the honor of Karel.","today,candle,honor","Elian Karel,Silvia Marek","Elian Karel,Silvia Marek,Karel",3,Elian Karel,Silvia Marek,,,
662.txt,20120622,"He grew with the spectrum of dead all around him.   Before Elian was 17 several of its members of family and the friends fought the constant disease, including its neighbor 10 years - old Juliana Vann. "" 

Marek made a pause one moment to allow the cries of ""remember Juliana!"" to fade.","spectrum,member,family,friend,disease,neighbor,year,pause,moment,cry","Elian Karel,Juliana Vann,Silvia Marek","Elian Karel,Juliana Vann,Silvia Marek,Juliana",4,Elian Karel,Juliana Vann,Silvia Marek,,
662.txt,20120622,"It had observed his father, Jeroen and the founder of the POK, walk of Henk Bodrogi the way even as it would go.","father,founder,way","Jeroen Karel,Henk Bodrogi","Jeroen Karel,Henk Bodrogi",2,Jeroen Karel,Henk Bodrogi,,,
668.txt,20010615,"Shortly after learning the death of Nespola, president Kapelou to that its cousin Vincent Kapelou announced as a new minister of its policy of health would serve.","death,cousin,minister,policy,health","Cesare Nespola,Kapelou,Vincent Kapelou","Nespola,Kapelou,Vincent Kapelou",3,Cesare Nespola,Kapelou II,Vincent Kapelou,,
670.txt,20100622,Marek replaced Elian Karel like figurehead popular of the POK movement the last summer.,"figurehead,movement,summer","Silvia Marek,Elian Karel","Silvia Marek,Elian Karel",2,Silvia Marek,Elian Karel,,,
679.txt,20140120,"The limaduras of IPO demonstrate that the executive group gained $327,25 million collective of the parts granted including $96,25 million by each one for the rasgueo of CFO Ingrid Barranco, Ada Campo-Corrente, and Orhan Strum of the COO.","limadura,ipo,group,collective,part,rasgueo","Ingrid Barranco,Ada Campo-Corrente,Orhan Strum","Ingrid Barranco,Ada Campo-Corrente,Orhan Strum",3,Ingrid Barranco,Ada Campo-Corrente,Orhan Strum,,
686.txt,20030519,"Hank Fluss are survived by its woman of 54 years, Beatriz Fluss,  5 children, and 12 children.","woman,year,child,child","Hank Fluss,Beatriz Fluss","Hank Fluss,Beatriz Fluss",2,Hank Fluss,Beatriz Fluss,,,
686.txt,20030519,"Hank Fluss brought 40 years which with befriending GAStech co-founder Sten Sanjorge, SR in 1963.","year,co,-,founder","Hank Fluss,Sanjorge Sr","Hank Fluss,Sten Sanjorge",2,Hank Fluss,Sanjorge Sr,,,
69.txt,19980319,"The two founders - Sten Sanjorge Sr and Hank Fluss - found wildcat drilling to be more lucrative, and thus began a series of environmental disasters and financial scandals that eventually ran Sanjorge Sr into an early grave and drove Fluss into a marginal role in his own company.","founder,wildcat,drilling,series,disaster,scandal,grave,role,company","Sanjorge Sr,Hank Fluss,Sanjorge Sr,Hank Fluss","Sten Sanjorge Sr,Hank Fluss,Sanjorge Sr,Hank Fluss",4,Sanjorge Sr,Hank Fluss,Sanjorge Sr,Hank Fluss,
698.txt,20120620,"By the time Elian was 17 many of his family members and friends were battling constant illness, including his neighbor 10-year old Juliana Vann.""","time,family,member,friend,illness,neighbor,year","Elian Karel,Juliana Vann","Elian Karel,Juliana Vann",2,Elian Karel,Juliana Vann,,,
698.txt,20120620,"He had watched his father, Jeroen and the founder of the POK, Henk Bodrogi, walk the very path he would tread.","father,founder,path","Jeroen Karel,Henk Bodrogi","Jeroen Karel,Henk Bodrogi",2,Jeroen Karel,Henk Bodrogi,,,
698.txt,20120620,"""Today we gather to remember Elian Karel,"" Silvia Marek told the rapt assembly, many of whom held up white candles in Karel's honor. 

""Elian was born on an Elodis farm not 40 minutes from here, to Jeroen and Antaura Karel.","today,assembly,candle,honor,farm,minute","Elian Karel,Silvia Marek,Elian Elian Karel,Jeroen Karel,Antaura Karel","Elian Karel,Silvia Marek,Karel,Elian Elian Karel,Jeroen Karel,Antaura Karel",6,Elian Karel,Silvia Marek,Elian Karel,Jeroen Karel,Antaura Karel
704.txt,20140119,We look forward to us hearing what president Kapelou II and CEO Sten Sanjorge Jr. one has come concerning how must say these unholy alliance to the citizens of Kronos at good.,"alliance,citizen","Kapelou II,Sanjorge Jr","Kapelou II,Sten Sanjorge Jr",2,Kapelou II,Sanjorge Jr,,,
709.txt,20120823,"Karel implied with POK since its commencement its father had been seen, Jeroen Karel, an original member was.","commencement,father,member","Elian Karel,Jeroen Karel","Elian Karel,Jeroen Karel",2,Elian Karel,Jeroen Karel,,,
713.txt,20140120,"The IPO filings show that the executive group earned a collective $327.25 million from the newly vested shares including $96.25 million each for CFO Ingrid Barranco, CIO Ada Campo-Corrente, and COO Orhan Strum.","ipo,filing,group,share","Ingrid Barranco,Ada Campo-Corrente,Orhan Strum","Ingrid Barranco,Ada Campo-Corrente,Orhan Strum",3,Ingrid Barranco,Ada Campo-Corrente,Orhan Strum,,
735.txt,20090309,"Karel ensured the control of POK of Henk Bodrogi, whose bad health forced to the bottom of the position.","control,health,bottom,position","Elian Karel,Henk Bodrogi","Karel,Henk Bodrogi",2,Elian Karel,Henk Bodrogi,,,
74.txt,20120824,"Karel had been implied POK since its beginning since his/her father, Jeroen Karel, were an original member.","beginning,father,member","Elian Karel,Jeroen Karel","Elian Karel,Jeroen Karel",2,Elian Karel,Jeroen Karel,,,
740.txt,19990709,"Thanks to minister Nespola no longer children must die.

Osvaldo refer to Juliana Vann, 10 years - old little girl that previous year to leukemia boring perationsverrichtingen upstream of its house to attribute to with benzene poisoning of gas died.","thank,child,year,girl,year,leukemia,perationsverrichtingen,house,benzene,poisoning,gas","Cesare Nespola,Carmine Osvaldo,Juliana Vann","Nespola,Osvaldo,Juliana Vann",3,Cesare Nespola,Carmine Osvaldo,Juliana Vann,,
741.txt,19980427,"It is obvious that it [Sanjorge] does not have any interest for the wellbeing of the residents of Elodis, or environment.""

Sten Sanjorge Jr., which had inherited its share to the company of his father in 1990, had developed a reputation for pitiless procedures of management.

""When we did not make progress with GAStech,"" Reynolds continued, ""the chiefs of the community decided to approach the government of Kronos for the assistance.","interest,wellbeing,resident,environment,share,company,father,reputation,procedure,management,progress,chief,community,government,assistance","Sanjorge Jr,Joclyn Reynolds","Sten Sanjorge Jr,Joclyn Reynolds",2,Sanjorge Jr,Joclyn Reynolds,,,
743.txt,20090307,"Karel took over POK leadership from Henk Bodrogi, whose ill health forced him down from the position.","leadership,health,position","Elian Karel,Henk Bodrogi","Karel,Henk Bodrogi",2,Elian Karel,Henk Bodrogi,,,
745.txt,20090621,"A unifying theme of the protesters was the chanted slogans including ""Justice for Elian"" in reference to previously mentioned activist Elian Karel and ""Remember Juliana"", a young girl from Elodis who died in 1998 allegedly from the effects of water contamination.","theme,protester,slogan,justice,reference,activist,girl,effect,water,contamination","Elian Karel,Juliana Vann","Elian Karel,Elian Karel,Juliana",3,Elian Karel,Juliana Vann,,,
746.txt,20010615,"ABILA, Kronos - It is with great sorrow that we announce the death of Minister of Health Cesare Nespola.","sorrow,death","Abila,Cesare Nespola","Abila,Cesare Nespola",2,Abila,Cesare Nespola,,,
746.txt,20010615,"Shortly after hearing of Nespola's death, President Kapelou announced that his nephew Vincent Kapelou would serve as his administration's new Minister of Health.","death,nephew,administration","Cesare Nespola,Kapelou,Vincent Kapelou","Nespola,Kapelou,Vincent Kapelou",3,Cesare Nespola,Kapelou II,Vincent Kapelou,,
753.txt,20120908,Posters with colorful images of Elian Karel and Juliana Vann were reminders of the heavy toll already paid by leaders and innocents.,"poster,image,reminder,toll,leader,innocent","Elian Karel,Juliana Vann","Elian Karel,Juliana Vann",2,Elian Karel,Juliana Vann,,,
767.txt,20100621,"POK supporters carried signs with pictures of Karel and Juliana Vann, chanted slogans, and lit candles.  

The peaceful demonstration turned violent when two POK members accosted a man who attempted to enter the building on business.  The POK members hit him with a bottle, which knocked him to the ground and gave him a bloody gash on his forehead.  Abila police attempted to gain control of the situation by using bullhorns to call for the peaceful dispersal of the crowd, but the crowd responded to their calls by hurling insults along with a few rocks at the officers.  Police used tear gas to end the gathering, but a handful of die-hard POK members urged the crowd into melee with the officers.","supporter,sign,picture,slogan,candle,demonstration,member,man,building,business,member,bottle,ground,gash,forehead,police,control,situation,bullhorn,dispersal,crowd,crowd,call,insult,rock,officer,police,gas,gathering,handful,member,crowd,melee,officer","Elian Karel, Juliana Vann","Karel,Juliana Vann",2,Elian Karel,Juliana Vann,,,
767.txt,20100621,Marek replaced Elian Karel as the popular figurehead of the POK movement last summer.,"figurehead,movement,summer","Silvia Marek,Elian Karel","Silvia Marek,Elian Karel",2,Silvia Marek,Elian Karel,,,
77.txt,20110621,"As reported at the time of Karel's death, several people close to the investigation reported that Karel's body showed signs of blunt force trauma, abrasions and lacerations which were not consistent with the cause of death reported by the police. 

Police have denied anything unusual happened in Karel's death and city officials claim the accusations of murder and wrongful death are asserted by POK rabble-rousers attempting to incite instability and violence. 

Yesterday on the morning of June 19th, a small group of POK supporters gathered in front of the Abila Police Station, holding photographs of Elian, and of another young martyr, Juliana Vann, the ten-year old girl who died in 1998 from cancer caused by benzene toxins in her drinking water.   

""Both of them died because of government lies and corruption,"" one man told me who asked that his name be withheld because of concerns of police retaliation.","time,death,people,investigation,body,sign,force,trauma,abrasion,laceration,cause,death,police,police,death,city,official,accusation,murder,death,rabble,rouser,instability,violence,yesterday,19th,group,supporter,front,photograph,martyr,year,girl,cancer,benzene,toxin,drinking,water,government,lie,corruption,man,name,concern,police,retaliation","Elian Karel,Juliana Vann","Karel,Karel,Karel,Elian Karel,Juliana Vann",5,Elian Karel,Juliana Vann,,,
780.txt,20010615,"Little time after intending to speak about dead about Nespola, President Kapelou announced that its nephew Vincent Kapelou would again serve minister of his administration of health.","time,nephew,minister,administration,health","Cesare Nespola,Kapelou,Vincent Kapelou","Nespola,Kapelou,Vincent Kapelou",3,Cesare Nespola,Kapelou II,Vincent Kapelou,,
787.txt,20140121,"Fourteen employees, including possibly five executive officers, are feared kidnapped yesterday by the ""Protectors of Kronos"".  Reported missing includes: GAStech President and CEO Sten Sanjorge Jr, CFO Ingrid Barranco, CIO Ada Campo-Corrente, COO Orhan Strum, and Environmental Officer Willem Vasco-Pais.","employee,officer,yesterday","Sanjorge Jr,Ingrid Barranco,Ada Campo-Corrente,Orhan Strum,Willem Vasco-Pais","Sten Sanjorge Jr,Ingrid Barranco,Ada Campo-Corrente,Orhan Strum,Willem Vasco-Pais",5,Sanjorge Jr,Ingrid Barranco,Ada Campo-Corrente,Orhan Strum,Willem Vasco-Pais
790.txt,20140120,"In attempt to find out what is going on, we have called the office of Orhan Strum, the GSAtech Chief Operating Officer.  His administrator answered the phone and informed us that Mr. Strum is unavailable.  We will continue calling GAStech until we reach someone who can inform us on the situation.","attempt,office,administrator,phone,situation","Orhan Strum,Orhan Strum","Orhan Strum,Orhan Strum",2,Orhan Strum,,,,
799.txt,20110622,"The police force has denied uncommon no matter what in death happened of Karel and the town civil servants require the charges of assassination and the unlawful dead by POK rabble-rousers trying instability and recall violence are claimed.

Yesterday on the morning of 19 June, collected a small group itself defenders POK for the mail of the police force Abila, photograph of Elian, and of another young martyr, Juliana Vann, ten years - old little girl that in 1998, to cancer which by benzene toxin is caused in its drinking water died.","police,force,death,town,servant,charge,assassination,dead,rabble,rouser,instability,violence,yesterday,group,mail,police,force,photograph,martyr,year,girl,cancer,benzene,toxin,drinking,water","Elian Karel,Juliana Vann","Karel,Elian Karel,Juliana Vann",3,Elian Karel,Juliana Vann,,,
801.txt,20090621,"An uniting topic of protesters was chanted slogans including justice for Elian in reference to activist Elian Karel earlier mentioned and reminds Juliana, a young little girl of Elodis who died according to reports in 1998, to the impact of water pollution.","topic,protester,slogan,including,justice,reference,activist,girl,report,impact,water,pollution","Elian Karel,Juliana Vann,","Elian Karel,Elian Karel,Juliana Vann,Elodis",4,Elian Karel,Juliana Vann,,,
827.txt,20140120,"930 - approximately 1000 that the morning reunion will conclude and CEO Sten Sanjorge, to the Jr. and to the executive group - Ingrid Barranco, Ada Campo-Corrente, Orhan Strum, and Willem Vasco-Pais - they will continue to one sponsored reception government of Kronos.","morning,reunion,group,reception,government","Sanjorge Sr,Ingrid Barranco,Ada Campo-Corrente,Orhan Strum,Willem Vasco-Pais","Sten Sanjorge,Ingrid Barranco,Ada Campo-Corrente,Orhan Strum,Willem Vasco-Pais",5,Sanjorge Sr,Ingrid Barranco,Ada Campo-Corrente,Orhan Strum,Willem Vasco-Pais
834.txt,20140120,"At roughly 1000 the morning meeting will end and CEO Sten Sanjorge, Jr. and the executive group - Ingrid Barranco, Ada Campo-Corrente, Orhan Strum, and Willem Vasco-Pais - will proceed to a Kronos Government sponsored reception.","morning,meeting,group,reception","Sanjorge Jr,Ingrid Barranco,Ada Campo-Corrente,Orhan Strum,Willem Vasco-Pais","Sten Sanjorge, Jr,Ingrid Barranco,Ada Campo-Corrente,Orhan Strum,Willem Vasco-Pais",6,Sanjorge Jr,Ingrid Barranco,Ada Campo-Corrente,Orhan Strum,Willem Vasco-Pais
86.txt,20131216,"The filings show that the GAStech - Kronos executives earned a collective $327.25 million from the newly vested shares including $96.25 million each for CFO Ingrid Barranco, CIO Ada Campo-Corrente, and COO Orhan Strum.","filing,executive,share","Ingrid Barranco,Ada Campo-Corrente,Orhan Strum","Ingrid Barranco,Ada Campo-Corrente,Orhan Strum",3,Ingrid Barranco,Ada Campo-Corrente,Orhan Strum,,
