noticia,fecha,oracion,sustantivos,personas,organizaciones,cant_personas,0,1,2,3,4
353.txt,20090622,"Resurrecting the embers of the Juliana Vann campaign, the 10 year old girl who died from illnesses attributed to the government-favored GASTech corporation's industrial waste streams in 1998, Karel was arrested and thrown in jail following a POK-initiated human roadblock in front of GAStech headquarters in May.","ember,campaign,year,girl,illness,government,corporation,waste,stream,jail,roadblock,front,headquarters","Elian Karel,Juliana Vann","Juliana Vann,Karel",2,Elian Karel,Juliana Vann,,,
360.txt,20131217,"Submitting to show to that GAStech - the staff employees Kronos deserved collective $327.25 millions each of the recently held shares of $96.25 millions for CFO Ingrid Barranco, CIO Ada campo-Corrente, and COO Orhan Strum.","staff,employee,share","Ingrid Barranco,Ada Campo-Corrente,Orhan Strum","Ingrid Barranco,Ada Campo-Corrente,Orhan Strum",3,Ingrid Barranco,Ada Campo-Corrente,Orhan Strum,,
363.txt,20010616,"Shortly after to hear speak of the death of Nespola, president Kapelou announced that his nephew Vincent Kapelou would serve as new minister of his administration of the health.","speak,death,nephew,minister,administration,health","Cesare Nespola,Kapelou,Vincent Kapelou","Nespola,Kapelou,Vincent Kapelou",3,Cesare Nespola,Kapelou II,Vincent Kapelou,,
371.txt,20030517,"Hank Fluss is survived by his wife of 54 years, Beatriz Fluss, his 5 children, and 12 grandchildren.","wife,year,child,grandchild","Hank Fluss,Beatriz Fluss","Hank Fluss,Beatriz Fluss",2,Hank Fluss,Beatriz Fluss,,,
374.txt,20130620,"A larger than usual crowd gathered in front of the Capitol building, waving signs holding pictures of Elian Karel and Juliana Vann, who were painted as POK ""martyrs"".   

Police and government security forces set up between the protestors and the Capitol building in a show of force, hoping to prevent the kind of chaos that occurred during last year's riot.","crowd,front,building,sign,picture,martyr,police,government,security,force,protestor,show,force,kind,chaos,year,riot","Elian Karel,Juliana Vann","Elian Karel,Juliana Vann",2,Elian Karel,Juliana Vann,,,
375.txt,20131217,"The filings show that the GAStech - Kronos executives earned a collective $327.25 million from the newly vested shares including $96.25 million each for CFO Ingrid Barranco, CIO Ada Campo-Corrente, and COO Orhan Strum.","filing,executive,share","Ingrid Barranco,Ada Campo-Corrente,Orhan Strum","Ingrid Barranco,Ada Campo-Corrente,Orhan Strum",3,Ingrid Barranco,Ada Campo-Corrente,Orhan Strum,,
379.txt,20120307,"I have doubled the size of my security force and sent my family away on an extended vacation.""

Kapelou, 39, was appointed to the position of Minister of Health in 2001 after the death of Cesare Nespola.","size,security,force,family,vacation,position,death","Kapelou,Cesare Nespola","Kapelou,Cesare Nespola",2,Kapelou II,Cesare Nespola,,,
385.txt,20090622,"A subject of the unification of the demonstrators was the mottos sung including ""justice for Elian"" in reference to the activist previously mentioned Elian Karel and ""to remember Julian"", a young girl of Elodis that died in 1998 alleged of the effects of the contamination of the water.","subject,unification,demonstrator,motto,justice,reference,activist,girl,effect,contamination,water","Elian Karel,Juliana Vann,","Elian Karel,Elian Karel,Juliana Vann,Elodis",4,Elian Karel,Juliana Vann,,,
387.txt,20090623,"<<deleted the image of Elian Karel that spoke in a meeting in Abila>>

The voice of the protest for some, demagog for others, protective of popularist of the leader Elian Karel de Kronos became martyr and a point of the meeting for some; a figure of the disdain and rabblerousing for others, and a political preoccupation to the government of Kronosian, within a filled year event, accentuated by its suspicious death Friday.","image,meeting,voice,protest,other,popularist,leader,martyr,point,meeting,figure,disdain,rabblerousing,other,preoccupation,government,year,event,death","Elian Karel,Elian Karel,","Elian Karel,Elian Karel,",3,Elian Karel,,,,
394.txt,20130621,"Larger than usual mob which is collected for the Capitol bldg., undulating signs of Elian Karel and Juliana Vann, which was painted as POK martyrs, sign.","mob,bldg,sign,martyr,sign","Elian Karel,Juliana Vann","Elian Karel,Juliana Vann",2,Elian Karel,Juliana Vann,,,
396.txt,20140121,"One fears fourteen employees, probably including five executive leaders, removed yesterday by the ""guards of Kronos"".  Disappeared paid include: President and PRESIDENT Sten Sanjorge Jr, CFO Ingrid Barranco, CIO Ada Campo-Corrente, Orhan Strum, and environmental leader Willem Vasco-Pais.

The local organizations of news received a note of ransom of the claiming responsibility and to require POK $20 million the company.  They is possible additional requests are received.

Sanjorge and the others disappeared according to a meeting from council to the registered offices from GASTech.","employee,leader,yesterday,guard,leader,organization,news,note,ransom,responsibility,company,request,other,meeting,council,office","Sanjorge Jr,Ingrid Barranco,Ada Campo-Corrente,Orhan Strum,Willem Vasco-Pais","Sten Sanjorge Jr,Ingrid Barranco,Ada Campo-Corrente,Orhan Strum,Willem Vasco-Pais,Sanjorge",6,Sanjorge Jr,Ingrid Barranco,Ada Campo-Corrente,Orhan Strum,Willem Vasco-Pais
40.txt,20140119,"Local GAStech executives Ingrid Barranco, Ada Campo-Corrente, Orhan Strum, and Willem Vasco-Pais and CEO Sten Sanjorge Jr. will attend a reception with government officials tomorrow following a business meeting at their headquarters building.","executive,reception,government,official,tomorrow,business,meeting,headquarters,building","Ingrid Barranco,Ada Campo-Corrente,Orhan Strum,Willem Vasco-Pais,Sanjorge Jr","Ingrid Barranco,Ada Campo-Corrente,Orhan Strum,Willem Vasco-Pais,Sten Sanjorge Jr",5,Ingrid Barranco,Ada Campo-Corrente,Orhan Strum,Willem Vasco-Pais,Sanjorge Jr
436.txt,20140119,"Local GAStech executives Ingrid Barranco, Ada Campo-Corrente, Orhan Strum, and Willem Vasco-Pais will attend a reception with government officials tomorrow following a business meeting at their headquarters building.","executive,reception,government,official,tomorrow,business,meeting,headquarters,building","Ingrid Barranco,Ada Campo-Corrente,Orhan Strum,Willem Vasco-Pais","Ingrid Barranco,Ada Campo-Corrente,Orhan Strum,Willem Vasco-Pais",4,Ingrid Barranco,Ada Campo-Corrente,Orhan Strum,Willem Vasco-Pais,
436.txt,20140119,"Government spokesman Rufus Drymiau informed The Star that Sten Sanjorge Jr., President and CEO of GAStech, has traveled from Tethys to attend the events.","government,spokesman,event","Rufus Drymiau,Sanjorge Jr","Rufus Drymiau,Sten Sanjorge Jr",2,Rufus Drymiau,Sanjorge Jr,,,
447.txt,20090308,"Karel took over POK leadership from Henk Bodrogi, whose ill health forced him down from the position.","leadership,health,position","Elian Karel,Henk Bodrogi","Karel,Henk Bodrogi",2,Elian Karel,Henk Bodrogi,,,
448.txt,19980321,"The two founders - Hank Fluss and Sten Sanjorge Sr.- found more profitable unreliable drilling to be, and started this way with a range environment calamities and financial scandals which Sanjorge Sr. eventual in an early sepulchre in and Fluss in a marginal role in its own company.","founder,drilling,way,range,environment,calamity,scandal,sepulchre,role,company","Hank Fluss,Sanjorge Sr,Sanjorge Sr,Hank Fluss","Hank Fluss,Sten Sanjorge Sr,Sanjorge Sr,Hank Fluss",4,Hank Fluss,Sanjorge Sr,Sanjorge Sr,Hank Fluss,
450.txt,20140120,"Uneasy throughout the call, Ms. Lagos repeated that Orhan Strum was unavailable at this time, said good bye and hung up.","call,time","Linda Lagos,Orhan Strum","Linda Lagos,Orhan Strum",2,Linda Lagos,Orhan Strum,,,
450.txt,20140120,"Linda Lagos the assistant to Mr. Strum declined to answer any further questions about the incident, whether or not there was a fire, a false alarm, a bomb threat, or whether or not anyone is missing.","assistant,question,incident,fire,alarm,bomb,threat","Linda Lagos,Orhan Strum","Linda Lagos,Orhan Strum",2,Linda Lagos,Orhan Strum,,,
450.txt,20140120,"A hesitant administrative assistant to Orhan Strum, Chief Operating Officer of GAStech claimed Mr. Strum was unavailable.",assistant,"Orhan Strum,Orhan Strum","Orhan Strum,Orhan Strum",2,Orhan Strum,,,,
454.txt,20090621,"Following the unexpected death of Elian Karel, Silvia Marek has taken over the leadership role of the Protectors of Kronos.","death,leadership,role","Elian Karel,Silvia Marek","Elian Karel,Silvia Marek",2,Elian Karel,Silvia Marek,,,
460.txt,20140121,"The disclosed disappear include: President and CEO Sten Sanjorge Jr, CFO Ingrid Barranco, Ada Campo-Corrente, COO Orhan Strum, and environmental official Willem Vasco-Pais.","disappear,official","Sanjorge Jr,Ingrid Barranco,Ada Campo-Corrente,Orhan Strum,Willem Vasco-Pais","Sten Sanjorge Jr,Ingrid Barranco,Ada Campo-Corrente,Orhan Strum,Willem Vasco-Pais",5,Sanjorge Jr,Ingrid Barranco,Ada Campo-Corrente,Orhan Strum,Willem Vasco-Pais
468.txt,19990707,"Thanks to Minister Nespola no more children will have to die.""

Osvaldo refers to Juliana Vann, a 10-year old girl who died last year from leukemia due to with benzene poisoning from gas drilling operations upstream from her home.","thank,child,year,girl,year,leukemia,benzene,poisoning,gas,drilling,operation,home","Cesare Nespola,Carmine Osvaldo,Juliana Vann","Nespola,Osvaldo,Juliana Vann",3,Cesare Nespola,Carmine Osvaldo,Juliana Vann,,
478.txt,19940218,"Sanjorge, Mr. is survived by its wife Ingrid Sanjorge and son Sten Sanjorge Jr.

""A great light in this world has been extinguished, he still throws a shade yet,"" said Sanjorge Jr, ""that I make vote lead to our company advanced with a renewed vision and a dignity that honor the life of my father and work.""","wife,son,light,world,shade,vote,company,vision,dignity,life,father,work","Ingrid Barranco,Sanjorge Jr,Sanjorge Sr","Sanjorge,Ingrid Barranco,Sten Sanjorge Jr,Sanjorge Jr",4,Ingrid Barranco,Sanjorge Jr,Sanjorge Sr,,
493.txt,20030519,"The Sanjorge spent 40 years with GAStech, befriending Hank Fluss in 1963 in which both began towards outside in his the own ones.","year,outside,one","Hank Fluss,Sanjorge Sr","Sanjorge,Hank Fluss",2,Hank Fluss,Sanjorge Sr,,,
493.txt,20030519,"Always a champion of environmental causes, Sanjorge had disillusioned more and more with the operation of GAStech - of Kronos that filtered its relation with the CEO Hank Fluss, Jr.","champion,cause,operation,relation","Hank Fluss,Sanjorge Jr","Sanjorge,Hank Fluss, Jr",3,Hank Fluss,Sanjorge Jr,,,
501.txt,19821004,"You note them in the constant basic image of the helicopters to-ing and of fro-ing outside to the areas moved away, and had aligned them with the airport of the city to make the shuttle of the execs in the two directions of the city.

And while you lead around the centrum, almost each round not is financed by a division of GAStech. 

Sanjorge recently started to pay more attention to the activities of leisures and philanthropy, allowing Sten Jr. and Hank Fluss cofounder to direct the company.","image,helicopter,area,airport,city,shuttle,exec,direction,city,centrum,round,division,attention,activity,leisure,philanthropy,cofounder,company","Sanjorge Jr,Hank Fluss","Sanjorge,Sten Jr,Hank Fluss",3,Sanjorge Jr,Hank Fluss,,,
508.txt,20100620,Marek replaced Elian Karel as the popular figurehead of the POK movement last summer.,"figurehead,movement,summer","Silvia Marek,Elian Karel","Silvia Marek,Elian Karel",2,Silvia Marek,Elian Karel,,,
508.txt,20100620,"POK supporters carried signs with pictures of Karel and Juliana Vann, chanted slogans, and lit candles. 

The peaceful demonstration turned violent when two POK members accosted a man who attempted to enter the building on business.  The POK members hit him with a bottle, which knocked him to the ground and gave him a bloody gash on his forehead.  Abila police attempted to gain control of the situation by using bullhorns to call for the peaceful dispersal of the crowd, but the crowd responded to their calls by hurling insults along with a few rocks at the officers.  Police used tear gas to end the gathering, but a handful of die-hard POK members urged the crowd into melee with the officers.","supporter,sign,picture,slogan,candle,demonstration,member,man,building,business,member,bottle,ground,gash,forehead,police,control,situation,bullhorn,dispersal,crowd,crowd,call,insult,rock,officer,police,gas,gathering,handful,member,crowd,melee,officer","Elian Karel, Juliana Vann","Karel,Juliana Vann",2,Elian Karel,Juliana Vann,,,
520.txt,20120908,The posters with coloured pictures of Elian Karel and Juliana Vann was memories of the heavy toll which is already paid by LEADERs and innocents.,"poster,picture,memory,toll,leader,innocent","Elian Karel,Juliana Vann","Elian Karel,Juliana Vann",2,Elian Karel,Juliana Vann,,,
525.txt,20140120,"shows collective $327.25 millions each executive to the group to that of the recently held shares including $96.25 millions for CFO Ingrid Barranco, CIO Ada campo-Corrente, and COO Orhan Strum deserved","million,executive,group,share,million","Ingrid Barranco,Ada Campo-Corrente,Orhan Strum","Ingrid Barranco,Ada Campo-Corrente,Orhan Strum",3,Ingrid Barranco,Ada Campo-Corrente,Orhan Strum,,
531.txt,19980320,"The two founders - Hank Fluss and Sten Sanjorge Sr. - wild drilling found with being more lucrative, and thus began a series of environmental disasters and scandals financial which ran thereafter  Sanjorge Sr. in a tomb early and led Fluss in a marginal role to its own company.","founder,drilling,series,disaster,scandal,tomb,role,company","Hank Fluss,Sanjorge Sr,Sanjorge Sr,Hank Fluss","Hank Fluss,Sten Sanjorge Sr,Sanjorge Sr,Hank Fluss",4,Hank Fluss,Sanjorge Sr,Sanjorge Sr,Hank Fluss,
538.txt,20130622,"A crowd larger than usual met in front of the building of capitol, undulating of the signs holding the images of Elian Karel and Juliana Vann, which were painted like POK ""martyrdoms"".  Crowd sang about the corruption of government and claimed President Dorel Kapelou to bring back.","crowd,front,building,capitol,sign,image,martyrdom,crowd,corruption,government","Elian Karel,Juliana Vann,Dorel Kapelou","Elian Karel,Juliana Vann,Dorel Kapelou",3,Elian Karel,Juliana Vann,Kapelou II,,
54.txt,20120822,"Karel had been involved with the POK since its inception given that his father, Jeroen Karel, was an original member.","inception,father,member","Elian Karel,Jeroen Karel","Elian Karel,Jeroen Karel",2,Elian Karel,Jeroen Karel,,,
544.txt,20010831,"The protestors, members of the activist group ""Protectors of Kronos"", held signs reading: ""Drilling Poisoned Our Water"" and ""Remember Juliana"", referring to 10 year old Juliana Vann, who has become an icon for the Protectors of Kronos since her death in 1998.","protestor,member,activist,group,sign,water,year,icon,death","Juliana Vann,Juliana Vann","Juliana Vann,Juliana Vann",2,Juliana Vann,,,,
549.txt,20120309,"Letters purported to be from the Protectors of Kronos (POK) have been received by Vincent Kapelou, Minister of Health and nephew of President Kapelou.","letter,nephew","Vincent Kapelou,Kapelou","Vincent Kapelou,Kapelou",2,Vincent Kapelou,Kapelou II,,,
55.txt,20140326,"""You cannot as soon as to rob our money and to think she can obtain to him far with him.""

The posters with colorful images of Elian Karel and Julian Vann were reminders of the heavy toll already paid by the leaders and innocents.","money,poster,image,reminder,toll,leader,innocent","Elian Karel,Julian Vann","Elian Karel,Julian Vann",2,Elian Karel,Juliana Vann,,,
559.txt,20131216,As for the particulars of the filing: Sanjorge Jr.'s 51% stake in the company is worth $1.96 billion; Beatriz Fluss' (widow of company co-founder Hank Fluss) 33% stake is worth $1.27 billion.,"particular,filing,%,stake,company,widow,company,co,-,founder,%,stake","Sanjorge Jr,Beatriz Fluss,Hank Fluss","Sanjorge Jr,Beatriz Fluss,Hank Fluss",3,Sanjorge Jr,Beatriz Fluss,Hank Fluss,,
559.txt,20131216,"The filings show that the GAStech - Kronos executives earned a collective $327.25 million from the newly vested shares including $96.25 million each for CFO Ingrid Barranco, CIO Ada Campo-Corrente, and COO Orhan Strum.","filing,executive,share","Ingrid Barranco,Ada Campo-Corrente,Orhan Strum","Ingrid Barranco,Ada Campo-Corrente,Orhan Strum",3,Ingrid Barranco,Ada Campo-Corrente,Orhan Strum,,
560.txt,20090517,"With international president and CEO Sten Sanjorge Jr. of GAStech and a large brass band, the new logo of the company indicated, part of the process rebranding of the company. 

During the press conference, Sten Sanjorge Jr. said the new logo - a non luminous flame of tripartite which is reminiscent of a sheet ""to help the GAStech position and its products like clean fuel alternative.""","president,brass,band,logo,company,part,process,rebranding,company,press,conference,logo,flame,tripartite,sheet,position,product,fuel,alternative","Sanjorge Jr,Sanjorge Jr","Sten Sanjorge Jr,Sten Sanjorge Jr",2,Sanjorge Jr,,,,
566.txt,20090812,When the official coroners report was released last month about the death of POK leader Elian Karel there was no mention of the wounds observed on Karels body by eyewitnesses.,"coroners,report,month,death,leader,mention,wound,body,eyewitness","Elian Karel,","Elian Karel,Karels",2,Elian Karel,,,,
569.txt,20140120,"Kronos Star reporters covering the reception at the capitol report having seen GAStech President and CEO, Sten Sanjorge Jr., but they have not seen Ingrid Barranco, Ada Campo-Corrente, Orhan Strum, or Willem Vasco-Pais.","reporter,reception,capitol","Sanjorge Jr,Ingrid Barranco,Ada Campo-Corrente,Orhan Strum,Willem Vasco-Pais","Sten Sanjorge Jr,Ingrid Barranco,Ada Campo-Corrente,Orhan Strum,Willem Vasco-Pais",5,Sanjorge Jr,Ingrid Barranco,Ada Campo-Corrente,Orhan Strum,Willem Vasco-Pais
570.txt,20120620,"""Today we gather to remember Elian Karel,"" Silvia Marek told the rapt assembly, many of whom held up white candles in Karel's honor.","today,assembly,candle,honor","Elian Karel,Silvia Marek","Elian Karel,Silvia Marek,Karel",3,Elian Karel,Silvia Marek,,,
570.txt,20120620,"By the time Elian was 17 many of his family members and friends were battling constant illness, including his neighbor 10

""Today we gather to remember Elian Karel,"" Silvia Marek told the rapt assembly, many of whom held up white candles in Karel's honor.","time,family,member,friend,illness,neighbor,today,assembly,candle,honor","Elian Karel,Elian Karel,Silvia Marek","Elian Karel,Elian Karel,Silvia Marek,Karel",4,Elian Karel,,Silvia Marek,,
570.txt,20120620,"By the time Elian was 17 many of his family members and friends were battling constant illness, including his neighbor 10-year old Juliana Vann.""","time,family,member,friend,illness,neighbor,year","Elian Karel,Juliana Vann","Elian Karel,Juliana Vann",2,Elian Karel,Juliana Vann,,,
572.txt,20120622,"""We collected today to remember Elian Karel,"" Silvia Marek we said the assembly of rapt, many of whom supported the white candles in the honor of Karel.","today,assembly,candle,honor","Elian Karel,Silvia Marek","Elian Karel,Silvia Marek,Karel",3,Elian Karel,Silvia Marek,,,
572.txt,20120622,"He had watched his father, to Jeroen and founder of the POK, long walk of Henk Bodrogi the same trajectory that he would be above.  Elian knew that the course would not be easy, and that it would leave just a short time by a personal life.","father,founder,walk,trajectory,course,time,life","Jeroen Karel,Henk Bodrogi,Elian Karel","Jeroen Karel,Henk Bodrogi,Elian Karel",3,Jeroen Karel,Henk Bodrogi,Elian Karel,,
581.txt,20100622,"Chanted the defenders behave signs POK with pictures of Karel and Juliana Vann, slogans, and strike candles to.","defender,sign,picture,slogan,candle","Elian Karel,Juliana Vann",POK,3,Elian Karel,Juliana Vann,,,
581.txt,20100622,Marek replaced Elian Karel as popular figurehead of the movement POK the previous summer.,"figurehead,movement,summer","Silvia Marek,Elian Karel","Silvia Marek,Elian Karel",2,Silvia Marek,Elian Karel,,,
584.txt,20120308,"Kapelou, 39, were appointed in the position of minister of health in 2001, after the death of Cesare Nespola.","position,minister,health,death","Kapelou,Cesare Nespola","Kapelou,Cesare Nespola",2,Kapelou II,Cesare Nespola,,,
587.txt,20030517,"Hank Fluss is survived by his wife of 54 years, Beatriz Fluss, his 5 children, and 12 grandchildren.","wife,year,child,grandchild","Hank Fluss,Beatriz Fluss","Hank Fluss,Beatriz Fluss",2,Hank Fluss,Beatriz Fluss,,,
587.txt,20030517,"Hank Fluss spent 40 years with GAStech, befriending Sten Sanjorge, Sr. in 1963 when the two started out on their own.",year,"Hank Fluss,Sanjorge Sr","Hank Fluss,Sten Sanjorge, Sr",3,Hank Fluss,Sanjorge Sr,,,
589.txt,20140119,"The local executives Ingrid Barranco, Ada Campo-Corrente, Orhan Strum, and Willem Vasco-Pais will be used a reception with civils servant as government following tomorrow a meeting of businesses to their construction of registered offices.","executive,reception,servant,government,following,tomorrow,meeting,business,construction,office","Ingrid Barranco,Ada Campo-Corrente,Orhan Strum,Willem Vasco-Pais","Ingrid Barranco,Ada Campo-Corrente,Orhan Strum,Willem Vasco-Pais",4,Ingrid Barranco,Ada Campo-Corrente,Orhan Strum,Willem Vasco-Pais,
589.txt,20140119,"The spokesman Rufus Drymiau of government informed to hold it the first role that Sten Sanjorge Jr., the president and CEO of GAStech, travelled of Tethys to attend the events.","spokesman,government,role,president,event","Rufus Drymiau,Sanjorge Jr","Rufus Drymiau,Sten Sanjorge Jr",2,Rufus Drymiau,Sanjorge Jr,,,
59.txt,20030518,"Hank Fluss is survived by his wife of 54 years, Beatriz Fluss, his 5 children, and 12 grandchildren.","wife,year,child,grandchild","Hank Fluss,Beatriz Fluss","Hank Fluss,Beatriz Fluss",2,Hank Fluss,Beatriz Fluss,,,
59.txt,20030518,"Hank Fluss spent 40 years with GAStech, befriending Sten Sanjorge, Sr.",year,"Hank Fluss,Sanjorge Sr","Hank Fluss,Sten Sanjorge, Sr",3,Hank Fluss,Sanjorge Sr,,,
593.txt,20010901,"The protesters, members of the activist group ""guards of Kronos"", held reading of signs: ""Drilling poisoned our water"" and ""to remember Juliana"", referring to 10 years Juliana Vann, which became an icon for the guards of Kronos since his death in 1998.","protester,member,activist,group,guard,sign,drilling,water,year,icon,guard,death","Juliana Vann,Juliana Vann","Juliana Vann,Juliana Vann",2,Juliana Vann,,,,
610.txt,20120310,"ABILA, Kronos - letters claimed to be from guards of Kronos (POK) were received by Vincent Kapelou, minister of health and nephew of President Kapelou.","letter,guard,minister,health,nephew","Vincent Kapelou,Kapelou","Vincent Kapelou,Kapelou",2,Vincent Kapelou,Kapelou II,,,
612.txt,19990708,"Osvaldo invoked the memory of Juliana Vann, a 10-year old girl who died last year from leukemia due to with benzene poisoning from gas drilling operations upstream from her home.","memory,year,girl,year,leukemia,benzene,poisoning,gas,drilling,operation,home","Carmine Osvaldo,Juliana Vann","Osvaldo,Juliana Vann",2,Carmine Osvaldo,Juliana Vann,,,
614.txt,20140119,"Tthe local GAStech executives Ingrid Barranco,  Ada Campo-Corren, Orhan Strum, and Willem Vasco-Pais will attend a reception with the officials of the government who tomorrow follow a business meeting in their construction of the headquarters.","executive,reception,official,government,tomorrow,business,meeting,construction,headquarters","Ingrid Barranco,Ada Campo-Corrente,Orhan Strum,Willem Vasco-Pais","Ingrid Barranco,Ada Campo-Corrente,Orhan Strum,Willem Vasco-Pais",4,Ingrid Barranco,Ada Campo-Corrente,Orhan Strum,Willem Vasco-Pais,
620.txt,20100622,"The defenders of POK carried signs with images of Karel and of Juliana Vann, slogans sang, and lit candles.","defender,sign,image,slogan,candle","Elian Karel, Juliana Vann","Karel,Juliana Vann",2,Elian Karel,Juliana Vann,,,
620.txt,20100622,Marek replaced Elian Karel as popular figurehead of the movement of POK the last summer.,"figurehead,movement,summer","Silvia Marek,Elian Karel","Silvia Marek,Elian Karel",2,Silvia Marek,Elian Karel,,,
626.txt,20000815,"At least four GAStech employees appeared to have been taken away by ambulance; however, GAStech has declined to comment on the extent and nature of their injuries.  

GAStech's CEO Sten Sanjorge Jr. downplayed the event stating, ""This event could hardly be described as an explosion,"" but merely a common practice referred to as flaring.  

Mrs. Cato and other locals from Elodis were turned away by GAStech employees and government officials.","employee,ambulance,extent,nature,injury,event,event,explosion,practice,flaring,local,employee,government,official","Sanjorge Jr,Rebecca Cato","Sten Sanjorge Jr,Cato",2,Sanjorge Jr,Rebecca Cato,,,
638.txt,19821002,"Sanjorge has recently started paying more attention to leisure activities and philanthropy, allowing his son Sten Jr. and co-founder Hank Fluss to run the company.","attention,leisure,activity,philanthropy,son,co,-,founder,company","Sanjorge Jr,Hank Fluss","Sanjorge,Sten Jr,Hank Fluss",3,Sanjorge Jr,Hank Fluss,,,
642.txt,20140120,"A titubante administrative assistant to the Orhan Strum, official of main operation of GAStech has exact the Mr. Strum was not available.","assistant,official,operation","Orhan Strum,Orhan Strum","Orhan Strum,Orhan Strum",2,Orhan Strum,,,,
642.txt,20140120,"Linda Lagos that the assistant to the Mr. Strum has refused to answer to new question approximately the event, if or not there were a fire, a false alarm, a threat of the bomb, or if or anyone does not lack.","assistant,question,event,fire,alarm,threat,bomb","Linda Lagos,Orhan Strum","Linda Lagos,Orhan Strum",2,Linda Lagos,Orhan Strum,,,
